school_id,school_year,standardized_school_name,original_school_name,year_school_opened,is_elementary_school,is_middle_school,is_high_school,is_other_school,admission_type,governance,serves_grade_k,serves_grade_1,serves_grade_2,serves_grade_3,serves_grade_4,serves_grade_5,serves_grade_6,serves_grade_7,serves_grade_8,serves_grade_9,serves_grade_10,serves_grade_11,serves_grade_12,that_col
1010,2024-2025,John Bartram High School,John Bartram High School,1939,0,0,1,0,Catchment,District,0,0,0,0,0,0,0,0,0,1,1,1,1,
1020,2024-2025,West Philadelphia High School,West Philadelphia High School,1911,0,0,1,0,Catchment,District,0,0,0,0,0,0,0,0,0,1,1,1,1,
1030,2024-2025,High School of the Future,High School of the Future,2006,0,0,1,0,Citywide,District,0,0,0,0,0,0,0,0,0,1,1,1,1,
1050,2024-2025,Paul Robeson High School for Human Services,Paul Robeson High School for Human Services,2003,0,0,1,0,Citywide,District,0,0,0,0,0,0,0,0,0,1,1,1,1,
1100,2024-2025,William L. Sayre High School,William L. Sayre High School,1950,0,0,1,0,Catchment,District,0,0,0,0,0,0,0,0,0,1,1,1,1,
1130,2024-2025,William T. Tilden Middle School,William T. Tilden Middle School,1927,0,1,0,0,Catchment,District,0,0,0,0,0,1,1,1,1,0,0,0,0,
1190,2024-2025,Motivation High School,Motivation High School,2004,0,0,1,0,Criteria-Based,District,0,0,0,0,0,0,0,0,0,1,1,1,1,
1200,2024-2025,John Barry School,John Barry School,2007,1,1,0,0,Catchment,District,1,1,1,1,1,1,1,1,1,0,0,0,0,
1230,2024-2025,William C. Bryant School,William C. Bryant School,1903,1,1,0,0,Catchment,District,1,1,1,1,1,1,1,1,1,0,0,0,0,
1250,2024-2025,Joseph W. Catharine School,Joseph W. Catharine School,1937,1,0,0,0,Catchment,District,1,1,1,1,1,1,0,0,0,0,0,0,0,
1260,2024-2025,Benjamin B. Comegys School,Benjamin B. Comegys School,1911,1,1,0,0,Catchment,District,1,1,1,1,1,1,1,1,1,0,0,0,0,
1280,2024-2025,Sadie T.M. Alexander UPenn Partnership School,Sadie T.M. Alexander UPenn Partnership School,2001,1,1,0,0,Catchment,District,1,1,1,1,1,1,1,1,1,0,0,0,0,
1290,2024-2025,Andrew Hamilton School,Andrew Hamilton School,1970,1,1,0,0,Catchment,District,1,1,1,1,1,1,1,1,1,0,0,0,0,
1300,2024-2025,Avery D. Harrington School,Avery D. Harrington School,1927,1,1,0,0,Catchment,District,1,1,1,1,1,1,1,1,1,0,0,0,0,
1340,2024-2025,Henry C. Lea School,Henry C. Lea School,1914,1,1,0,0,Catchment,District,1,1,1,1,1,1,1,1,1,0,0,0,0,
1350,2024-2025,William C. Longstreth School,William C. Longstreth School,1971,1,1,0,0,Catchment,District,1,1,1,1,1,1,1,1,1,0,0,0,0,
1360,2024-2025,Morton McMichael School,Morton McMichael School,1963,1,1,0,0,Catchment,District,1,1,1,1,1,1,1,1,1,0,0,0,0,
1370,2024-2025,S. Weir Mitchell School,S. Weir Mitchell School,1916,1,1,0,0,Catchment,District,1,1,1,1,1,1,1,1,1,0,0,0,0,
1380,2024-2025,Thomas G. Morton School,Thomas G. Morton School,1971,1,0,0,0,Catchment,District,1,1,1,1,1,1,0,0,0,0,0,0,0,
1390,2024-2025,Samuel Powel School,Samuel Powel School,1961,1,0,0,0,Catchment,District,1,1,1,1,1,0,0,0,0,0,0,0,0,
1400,2024-2025,John M. Patterson School,John M. Patterson School,1921,1,0,0,0,Catchment,District,1,1,1,1,1,0,0,0,0,0,0,0,0,
1410,2024-2025,James Rhoads School,James Rhoads School,1960,1,1,0,0,Catchment,District,1,1,1,1,1,1,1,1,1,0,0,0,0,
1420,2024-2025,Martha Washington School,Martha Washington School,1930,1,1,0,0,Catchment,District,1,1,1,1,1,1,1,1,1,0,0,0,0,
1440,2024-2025,Penrose School,Penrose School,1971,1,1,0,0,Catchment,District,1,1,1,1,1,1,1,1,1,0,0,0,0,
1460,2024-2025,Add B. Anderson School,Add B. Anderson School,1963,1,1,0,0,Catchment,District,1,1,1,1,1,1,1,1,1,0,0,0,0,
1470,2024-2025,Alain Locke School,Alain Locke School,1964,1,1,0,0,Catchment,District,1,1,1,1,1,1,1,1,1,0,0,0,0,
1490,2024-2025,Rudolph Blankenburg School,Rudolph Blankenburg School,1925,1,1,0,0,Catchment,District,1,1,1,1,1,1,1,1,1,0,0,0,0,
1580,2024-2025,Middle Years Alternative School,Middle Years Alternative School,1972,0,1,0,0,Citywide,District,0,0,0,0,0,1,1,1,1,0,0,0,0,
2000,2024-2025,South Philadelphia High School,South Philadelphia High School,1957,0,0,1,0,Catchment,District,0,0,0,0,0,0,0,0,0,1,1,1,1,
2010,2024-2025,Benjamin Franklin High School,Benjamin Franklin High School,1958,0,0,1,0,Catchment,District,0,0,0,0,0,0,0,0,0,1,1,1,1,
2020,2024-2025,High School for Creative and Performing Arts,High School for Creative and Performing Arts,1997,0,0,1,0,Criteria-Based,District,0,0,0,0,0,0,0,0,0,1,1,1,1,
2050,2024-2025,Science Leadership Academy Middle School,Science Leadership Academy Middle School,2016,0,1,0,0,Catchment,District,0,0,0,0,0,1,1,1,1,0,0,0,0,
2140,2024-2025,Julia R. Masterman High School,Julia R. Masterman High School,1933,0,1,1,0,Criteria-Based,District,0,0,0,0,0,1,1,1,1,1,1,1,1,
2160,2024-2025,Horace Furness High School,Horace Furness High School,1912,0,0,1,0,Catchment,District,0,0,0,0,0,0,0,0,0,1,1,1,1,
2190,2024-2025,D. Newlin Fell School,D. Newlin Fell School,1924,1,1,0,0,Catchment,District,1,1,1,1,1,1,1,1,1,0,0,0,0,
2210,2024-2025,Bache-Martin School,Bache-Martin School,1906,1,1,0,0,Catchment,District,1,1,1,1,1,1,1,1,1,0,0,0,0,
2240,2024-2025,F. Amedee Bregy School,F. Amedee Bregy School,1923,1,1,0,0,Catchment,District,1,1,1,1,1,1,1,1,1,0,0,0,0,
2260,2024-2025,George W. Childs School,George W. Childs School,1927,1,1,0,0,Catchment,District,1,1,1,1,1,1,1,1,1,0,0,0,0,
2290,2024-2025,Franklin Learning Center,Franklin Learning Center,1978,0,0,1,0,Criteria-Based,District,0,0,0,0,0,0,0,0,0,1,1,1,1,
2310,2024-2025,Achieve Academy of Philadelphia,Achieve Academy of Philadelphia,2004,0,1,1,0,Alternative,Contracted,0,0,0,0,0,0,1,1,1,1,1,1,1,
2320,2024-2025,Stephen Girard School,Stephen Girard School,1959,1,0,0,0,Catchment,District,1,1,1,1,1,0,0,0,0,0,0,0,0,
2340,2024-2025,General George A. McCall School,General George A. McCall School,1909,1,1,0,0,Catchment,District,1,1,1,1,1,1,1,1,1,0,0,0,0,
2370,2024-2025,Delaplaine McDaniel School,Delaplaine McDaniel School,1937,1,1,0,0,Catchment,District,1,1,1,1,1,1,1,1,1,0,0,0,0,
2380,2024-2025,William M. Meredith School,William M. Meredith School,1931,1,1,0,0,Catchment,District,1,1,1,1,1,1,1,1,1,0,0,0,0,
2390,2024-2025,Robert Morris School,Robert Morris School,1964,1,1,0,0,Catchment,District,1,1,1,1,1,1,1,1,1,0,0,0,0,
2410,2024-2025,Girard Academic Music Program High School,Girard Academic Music Program High School,1914,0,1,1,0,Criteria-Based,District,0,0,0,0,0,1,1,1,1,1,1,1,1,
2450,2024-2025,Edwin M. Stanton School,Edwin M. Stanton School,1926,1,1,0,0,Catchment,District,1,1,1,1,1,1,1,1,1,0,0,0,0,
2470,2024-2025,Albert M. Greenfield School,Albert M. Greenfield School,1970,1,1,0,0,Catchment,District,1,1,1,1,1,1,1,1,1,0,0,0,0,
2480,2024-2025,Marian Anderson Neighborhood Academy,Marian Anderson Neighborhood Academy,1964,1,1,0,0,Catchment,District,1,1,1,1,1,1,1,1,1,0,0,0,0,
2490,2024-2025,Laura W. Waring School,Laura W. Waring School,1956,1,1,0,0,Catchment,District,1,1,1,1,1,1,1,1,1,0,0,0,0,
2510,2024-2025,Fanny Jackson Coppin School,Fanny Jackson Coppin School,1925,1,1,0,0,Catchment,District,1,1,1,1,1,1,1,1,1,0,0,0,0,
2520,2024-2025,Abram S. Jenks School,Abram S. Jenks School,1897,1,0,0,0,Catchment,District,1,1,1,1,1,1,0,0,0,0,0,0,0,
2530,2024-2025,Philadelphia Juvenile Justice Services Center,Philadelphia Juvenile Justice Services Center,2012,0,1,1,0,Alternative,District,1,1,1,1,1,1,1,1,1,1,1,1,1,
2540,2024-2025,Francis S. Key School,Francis S. Key School,1889,1,0,0,0,Catchment,District,1,1,1,1,1,1,1,0,0,0,0,0,0,
2580,2024-2025,Eliza B. Kirkbride School,Eliza B. Kirkbride School,1926,1,1,0,0,Catchment,District,1,1,1,1,1,1,1,1,1,0,0,0,0,
2590,2024-2025,George W. Nebinger School,George W. Nebinger School,1925,1,1,0,0,Catchment,District,1,1,1,1,1,1,1,1,1,0,0,0,0,
2620,2024-2025,Academy at Palumbo,Academy at Palumbo,2006,0,0,1,0,Criteria-Based,District,0,0,0,0,0,0,0,0,0,1,1,1,1,
2630,2024-2025,George W. Sharswood School,George W. Sharswood School,1906,1,1,0,0,Catchment,District,1,1,1,1,1,1,1,1,1,0,0,0,0,
2640,2024-2025,Southwark School,Southwark School,1905,1,1,0,0,Catchment,District,1,1,1,1,1,1,1,1,1,0,0,0,0,
2650,2024-2025,Science Leadership Academy High School,Science Leadership Academy High School,2006,0,0,1,0,Criteria-Based,District,0,0,0,0,0,0,0,0,0,1,1,1,1,
2670,2024-2025,Constitution High School,Constitution High School,2006,0,0,1,0,Citywide,District,0,0,0,0,0,0,0,0,0,1,1,1,1,
2680,2024-2025,The Science Leadership Academy at Beeber High School,The Science Leadership Academy at Beeber High School,2014,0,1,1,0,Criteria-Based,District,0,0,0,0,0,1,1,1,1,1,1,1,1,
2690,2024-2025,John H. Taggart School,John H. Taggart School,1917,1,1,0,0,Catchment,District,1,1,1,1,1,1,1,1,1,0,0,0,0,
2720,2024-2025,Vare-Washington School,Vare-Washington School,1903,1,1,0,0,Catchment,District,1,1,1,1,1,1,1,1,1,0,0,0,0,
3040,2024-2025,Excel Middle Years Academy,Excel Middle Years Academy,2017,0,1,0,0,Alternative,Contracted,0,0,0,0,0,0,1,1,1,0,0,0,0,
3190,2024-2025,Crossroads at Hunting Park,Crossroads at Hunting Park,2011,1,0,0,0,Alternative,District,0,0,0,1,1,1,1,0,0,0,0,0,0,
3210,2024-2025,Ben Franklin High School EOP,Ben Franklin High School EOP,2012,0,0,1,0,Alternative,District,0,0,0,0,0,0,0,0,0,1,1,1,1,
3240,2024-2025,The Fortis Program,The Fortis Program,2017,0,0,1,0,Alternative,Contracted,0,0,0,0,0,0,0,0,0,1,1,1,1,
3290,2024-2025,Excel Academy South,Excel Academy South,2008,0,0,1,0,Alternative,Contracted,0,0,0,0,0,0,0,0,0,1,1,1,1,
3291,2024-2025,Excel Academy Central,Excel Academy Central,2023,0,0,1,0,Alternative,Contracted,0,0,0,0,0,0,0,0,0,1,1,1,1,
3292,2024-2025,The Academy of Continued Education School,The Academy of Continued Education School,2023,0,0,0,1,Virtual,District,1,1,1,1,1,1,1,1,1,1,1,1,1,
3301,2024-2025,Community Academy of Philadelphia Charter School,Community Academy of Philadelphia Charter School,1997,1,1,1,0,Citywide,Charter,1,1,1,1,1,1,1,1,1,1,1,1,1,
3302,2024-2025,Harambee Institute of Science and Technology Charter School,Harambee Institute of Science and Technology Charter School,1997,1,1,0,0,Citywide,Charter,1,1,1,1,1,1,1,1,1,0,0,0,0,
3304,2024-2025,YouthBuild Philadelphia Charter School,YouthBuild Philadelphia Charter School,1997,0,0,1,0,Citywide With Criteria,Charter,0,0,0,0,0,0,0,0,0,0,0,0,1,
3306,2024-2025,Christopher Columbus Charter School,Christopher Columbus Charter School,1999,1,1,0,0,Citywide,Charter,1,1,1,1,1,0,0,0,0,0,0,0,0,
3307,2024-2025,Eugenio Maria De Hostos Charter School,Eugenio Maria De Hostos Charter School,1998,1,1,0,0,Citywide,Charter,1,1,1,1,1,1,1,1,1,0,0,0,0,
3308,2024-2025,Inquiry Charter School,Inquiry Charter School,1998,1,0,0,0,Citywide,Charter,1,1,1,1,1,1,0,0,0,0,0,0,0,
3309,2024-2025,Imhotep Institute Charter High School,Imhotep Institute Charter High School,1998,0,0,1,0,Citywide,Charter,0,0,0,0,0,0,0,0,0,1,1,1,1,
3310,2024-2025,Laboratory Charter School of Communication and Languages,Laboratory Charter School of Communication and Languages,1998,1,1,0,0,Citywide,Charter,1,1,1,1,1,1,1,1,1,0,0,0,0,
3312,2024-2025,Multicultural Academy Charter School,Multicultural Academy Charter School,1998,0,0,1,0,Citywide,Charter,0,0,0,0,0,0,0,0,0,1,1,1,1,
3313,2024-2025,"Preparatory Charter School of Mathematics, Science, Technology and Careers","Preparatory Charter School of Mathematics, Science, Technology and Careers",1998,0,0,1,0,Citywide,Charter,0,0,0,0,0,0,0,0,0,1,1,1,1,
3314,2024-2025,West Oak Lane Charter School,West Oak Lane Charter School,1998,1,1,0,0,Citywide,Charter,1,1,1,1,1,1,1,1,1,0,0,0,0,
3315,2024-2025,Alliance For Progress Charter School,Alliance For Progress Charter School,1998,1,1,0,0,Citywide,Charter,1,1,1,1,1,1,0,0,0,0,0,0,0,
3318,2024-2025,Freire Charter School,Freire Charter School,1999,0,1,1,0,Citywide,Charter,0,0,0,0,0,1,1,1,1,1,1,1,1,
3322,2024-2025,Philadelphia Academy Charter School,Philadelphia Academy Charter School,1999,1,1,1,0,Citywide,Charter,1,1,1,1,1,1,1,1,1,1,1,1,1,
3323,2024-2025,Mastery Charter School at Hardy Williams,Mastery Charter School at Hardy Williams,1999,1,1,1,0,Citywide With Criteria,Charter,1,1,1,1,1,1,1,1,1,1,1,1,1,
3326,2024-2025,Universal Institute Charter School,Universal Institute Charter School,1999,1,1,0,0,Citywide,Charter,1,1,1,1,1,1,1,1,1,0,0,0,0,
3328,2024-2025,"Mathematics, Science, and Technology Community Charter School (MaST)","Mathematics, Science, and Technology Community Charter School (MaST)",1999,1,1,1,0,Citywide,Charter,1,1,1,1,1,1,1,1,1,1,1,1,1,
3329,2024-2025,Young Scholars Charter School,Young Scholars Charter School,1999,0,1,0,0,Citywide,Charter,0,0,0,0,0,0,1,1,1,0,0,0,0,
3331,2024-2025,Franklin Towne Charter High School,Franklin Towne Charter High School,2000,0,0,1,0,Citywide With Criteria,Charter,0,0,0,0,0,0,0,0,0,1,1,1,1,
3332,2024-2025,Mariana Bracetti Academy Charter School,Mariana Bracetti Academy Charter School,2000,1,1,1,0,Citywide,Charter,1,1,1,1,1,1,1,1,1,1,1,1,1,
3333,2024-2025,Esperanza Academy Charter School,Esperanza Academy Charter School,2000,1,1,1,0,Citywide,Charter,0,0,0,0,0,1,1,1,1,1,1,1,1,
3334,2024-2025,New Foundations Charter School,New Foundations Charter School,2000,1,1,1,0,Citywide With Criteria,Charter,1,1,1,1,1,1,1,1,1,1,1,1,1,
3335,2024-2025,People for People Charter School,People for People Charter School,2001,1,1,1,0,Citywide,Charter,1,1,1,1,1,1,1,1,1,1,1,1,1,
3336,2024-2025,Philadelphia Performing Arts Charter School,Philadelphia Performing Arts Charter School,2000,1,1,1,0,Citywide With Criteria,Charter,1,1,1,1,1,1,1,1,1,1,1,1,1,
3337,2024-2025,Global Leadership Academy Charter School,Global Leadership Academy Charter School,2000,1,1,0,0,Citywide,Charter,1,1,1,1,1,1,1,1,1,0,0,0,0,
3341,2024-2025,Independence Charter School,Independence Charter School,2001,1,1,0,0,Citywide,Charter,1,1,1,1,1,1,1,1,1,0,0,0,0,
3353,2024-2025,KIPP DuBois Charter School,KIPP DuBois Charter School,2015,0,0,1,0,Citywide With Criteria,Charter,0,0,0,0,0,0,0,0,0,1,1,1,1,
3357,2024-2025,West Philadelphia Achievement Charter School,West Philadelphia Achievement Charter School,2002,1,0,0,0,Citywide,Charter,1,1,1,1,1,1,0,0,0,0,0,0,0,
3358,2024-2025,Philadelphia Electrical and Technology Charter High School,Philadelphia Electrical and Technology Charter High School,2002,0,0,1,0,Citywide,Charter,0,0,0,0,0,0,0,0,0,1,1,1,1,
3359,2024-2025,Richard Allen Preparatory Charter School,Richard Allen Preparatory Charter School,2001,0,1,0,0,Citywide,Charter,0,0,0,0,0,1,1,1,1,0,0,0,0,
3360,2024-2025,Russell Byers Charter School,Russell Byers Charter School,2001,1,1,0,0,Citywide,Charter,1,1,1,1,1,1,1,1,1,0,0,0,0,
3361,2024-2025,Mastery Charter High School,Mastery Charter High School,2001,0,1,1,0,Citywide With Criteria,Charter,0,0,0,0,0,0,0,1,1,1,1,1,1,
3362,2024-2025,Wissahickon Charter School,Wissahickon Charter School,2002,1,1,0,0,Citywide With Criteria,Charter,1,1,1,1,1,1,1,1,1,0,0,0,0,
3364,2024-2025,First Philadelphia Preparatory Charter School,First Philadelphia Preparatory Charter School,2002,1,1,1,0,Citywide With Criteria,Charter,1,1,1,1,1,1,1,1,1,1,1,1,1,
3365,2024-2025,Green Woods Charter School,Green Woods Charter School,2002,1,1,0,0,Citywide With Criteria,Charter,1,1,1,1,1,1,1,1,1,0,0,0,0,
3366,2024-2025,Maritime Academy Charter School,Maritime Academy Charter School,2003,1,1,1,0,Citywide,Charter,1,1,1,1,1,1,1,1,1,1,1,1,1,
3368,2024-2025,Belmont Elementary Charter School,Belmont Elementary Charter School,2005,1,1,1,0,Catchment,Charter,1,1,1,1,1,1,1,1,1,1,1,1,1,
3370,2024-2025,KIPP Philadelphia Charter School,KIPP Philadelphia Charter School,2003,1,1,0,0,Citywide,Charter,1,1,1,1,1,1,1,1,1,0,0,0,0,
3372,2024-2025,The Jacquelyn Y. Kelley Discovery Charter School,The Jacquelyn Y. Kelley Discovery Charter School,2003,1,1,0,0,Citywide,Charter,1,1,1,1,1,1,1,1,1,0,0,0,0,
3378,2024-2025,Philadelphia Montessori Charter School,Philadelphia Montessori Charter School,2004,1,0,0,0,Citywide,Charter,1,1,1,1,1,1,1,0,0,0,0,0,0,
3379,2024-2025,Ad Prima Charter School,Ad Prima Charter School,2004,1,1,0,0,Citywide,Charter,1,1,1,1,1,1,1,1,1,0,0,0,0,
3383,2024-2025,Mastery Charter School at Shoemaker,Mastery Charter School at Shoemaker,2006,0,1,1,0,Citywide With Criteria,Charter,0,0,0,0,0,0,0,1,1,1,1,1,1,
3384,2024-2025,Folk Arts-Cultural Treasures Charter School,Folk Arts-Cultural Treasures Charter School,2005,1,1,0,0,Citywide,Charter,1,1,1,1,1,1,1,1,1,0,0,0,0,
3385,2024-2025,Mastery Charter School at Thomas Campus,Mastery Charter School at Thomas Campus,2005,1,1,1,0,Citywide With Criteria,Charter,1,1,1,1,1,1,1,1,1,1,1,1,1,
3386,2024-2025,Northwood Academy Charter School,Northwood Academy Charter School,2005,1,1,0,0,Citywide With Criteria,Charter,1,1,1,1,1,1,1,1,1,0,0,0,0,
3388,2024-2025,Boys Latin of Philadelphia Charter School,Boys Latin of Philadelphia Charter School,2007,0,1,1,0,Citywide,Charter,0,0,0,0,0,0,1,1,1,1,1,1,1,
3389,2024-2025,Keystone Academy Charter School,Keystone Academy Charter School,2007,1,1,0,0,Citywide,Charter,1,1,1,1,1,1,1,1,1,0,0,0,0,
3392,2024-2025,Southwest Leadership Academy Charter School,Southwest Leadership Academy Charter School,2007,1,1,0,0,Citywide With Criteria,Charter,1,1,1,1,1,1,1,1,1,0,0,0,0,
3393,2024-2025,Mastery Charter School at Pickett,Mastery Charter School at Pickett,2007,0,1,1,0,Citywide With Criteria,Charter,0,0,0,0,0,0,1,1,1,1,1,1,1,
3394,2024-2025,Pan American Academy Charter School,Pan American Academy Charter School,2008,1,1,0,0,Citywide With Criteria,Charter,1,1,1,1,1,1,1,1,1,0,0,0,0,
3395,2024-2025,Antonia Pantoja Charter School,Antonia Pantoja Charter School,2008,1,1,0,0,Citywide,Charter,1,1,1,1,1,1,1,1,1,0,0,0,0,
3399,2024-2025,Sankofa Freedom Academy Charter School,Sankofa Freedom Academy Charter School,2009,1,1,1,0,Citywide With Criteria,Charter,1,1,1,1,1,1,1,1,1,1,1,1,1,
3403,2024-2025,Franklin Towne Charter Elementary School,Franklin Towne Charter Elementary School,2009,1,1,0,0,Citywide With Criteria,Charter,1,1,1,1,1,1,1,1,1,0,0,0,0,
3404,2024-2025,Tacony Academy Charter School,Tacony Academy Charter School,2009,1,1,1,0,Citywide With Criteria,Charter,1,1,1,1,1,1,1,1,1,1,1,1,1,
3407,2024-2025,Mastery Charter School at Harrity,Mastery Charter School at Harrity,2010,1,1,0,0,Catchment,Charter,1,1,1,1,1,1,1,1,1,0,0,0,0,
3408,2024-2025,Mastery Charter School at Mann,Mastery Charter School at Mann,2010,1,0,0,0,Catchment,Charter,1,1,1,1,1,1,1,0,0,0,0,0,0,
3409,2024-2025,Mastery Charter School at Smedley,Mastery Charter School at Smedley,2010,1,0,0,0,Catchment,Charter,1,1,1,1,1,1,1,0,0,0,0,0,0,
3412,2024-2025,Mastery Charter School at Douglass,Mastery Charter School at Douglass,2010,1,1,0,0,Catchment,Charter,1,1,1,1,1,1,1,1,1,0,0,0,0,
3415,2024-2025,Mastery Charter School at Clymer,Mastery Charter School at Clymer,2011,1,0,0,0,Catchment,Charter,1,1,1,1,1,1,1,0,0,0,0,0,0,
3416,2024-2025,Mastery Charter School at Gratz,Mastery Charter School at Gratz,2011,0,1,1,0,Catchment,Charter,0,0,0,0,0,0,0,1,1,1,1,1,1,
3417,2024-2025,Universal Charter School at Audenried,Universal Charter School at Audenried,2011,0,0,1,0,Catchment,Charter,0,0,0,0,0,0,0,0,0,1,1,1,1,
3418,2024-2025,Universal Charter School at Vare,Universal Charter School at Vare,2011,0,1,0,0,Catchment,Charter,0,0,0,0,0,1,1,1,1,0,0,0,0,
3419,2024-2025,General David B. Birney Charter School,General David B. Birney Charter School,2011,1,1,0,0,Catchment,Charter,1,1,1,1,1,1,1,1,1,0,0,0,0,
3420,2024-2025,Mastery Charter School at Cleveland,Mastery Charter School at Cleveland,2012,1,1,0,0,Catchment,Charter,1,1,1,1,1,1,1,1,1,0,0,0,0,
3421,2024-2025,Universal Charter School at Creighton,Universal Charter School at Creighton,2012,1,1,0,0,Catchment,Charter,1,1,1,1,1,1,1,1,1,0,0,0,0,
3422,2024-2025,The Philadelphia Charter School for Arts and Sciences,The Philadelphia Charter School for Arts and Sciences,2012,1,1,0,0,Catchment,Charter,1,1,1,1,1,1,1,1,1,0,0,0,0,
3423,2024-2025,Memphis Street Academy Charter School at J.P. Jones,Memphis Street Academy Charter School at J.P. Jones,2012,0,1,0,0,Catchment,Charter,0,0,0,0,0,1,1,1,1,0,0,0,0,
3424,2024-2025,Universal Charter School at Alcorn,Universal Charter School at Alcorn,2013,1,1,0,0,Catchment,Charter,1,1,1,1,1,1,1,1,1,0,0,0,0,
3426,2024-2025,Mastery Charter School at Pastorius,Mastery Charter School at Pastorius,2013,1,1,0,0,Catchment,Charter,1,1,1,1,1,1,1,1,1,0,0,0,0,
3427,2024-2025,Mastery Charter School at Wister,Mastery Charter School at Wister,2016,1,0,0,0,Catchment,Charter,1,1,1,1,1,1,0,0,0,0,0,0,0,
3428,2024-2025,Global Leadership Academy Charter School Southwest at Huey,Global Leadership Academy Charter School Southwest at Huey,2016,1,1,0,0,Catchment,Charter,1,1,1,1,1,1,1,1,1,0,0,0,0,
3436,2024-2025,KIPP Octavius Catto Charter School,KIPP Octavius Catto Charter School,2022,1,0,0,0,Citywide,Charter,1,1,1,0,0,0,0,0,0,0,0,0,0,
3437,2024-2025,KIPP North Philadelphia Charter School,KIPP North Philadelphia Charter School,2018,1,0,0,0,Citywide,Charter,1,1,1,1,1,1,0,0,0,0,0,0,0,
3438,2024-2025,Deep Roots Charter School,Deep Roots Charter School,2018,1,0,0,0,Citywide With Criteria,Charter,1,1,1,1,1,1,0,0,0,0,0,0,0,
3439,2024-2025,Mastery Prep Elementary Charter School,Mastery Prep Elementary Charter School,2018,1,0,0,0,Citywide,Charter,1,1,1,1,0,0,0,0,0,0,0,0,0,
3440,2024-2025,MaST Community Charter School II,MaST Community Charter School II,2016,1,0,1,0,Citywide,Charter,1,1,1,1,1,1,1,0,0,1,0,0,0,
3441,2024-2025,TECH Freire Charter School,TECH Freire Charter School,2016,0,0,1,0,Citywide With Criteria,Charter,0,0,0,0,0,0,0,0,0,1,1,1,1,
3442,2024-2025,Independence Charter School West,Independence Charter School West,2016,1,1,0,0,Citywide With Criteria,Charter,1,1,1,1,1,1,1,1,1,0,0,0,0,
3443,2024-2025,KIPP West Philadelphia Charter School,KIPP West Philadelphia Charter School,2016,1,0,0,0,Citywide,Charter,1,1,1,1,1,0,0,0,0,0,0,0,0,
3445,2024-2025,MAST Community Charter School III,MAST Community Charter School III,2019,1,0,0,0,Citywide With Criteria,Charter,1,1,1,1,1,1,1,1,1,0,0,0,0,
3446,2024-2025,Philadelphia Hebrew Public Charter School,Philadelphia Hebrew Public Charter School,2019,1,0,0,0,Citywide,Charter,1,1,0,0,0,0,0,0,0,0,0,0,0,
3510,2024-2025,El Centro de Estudiantes,El Centro de Estudiantes,2009,0,0,1,0,Alternative,Contracted,0,0,0,0,0,0,0,0,0,1,1,1,1,
3810,2024-2025,One Bright Ray - Elmwood,One Bright Ray - Elmwood,2015,0,0,1,0,Alternative,Contracted,0,0,0,0,0,0,0,0,0,1,1,1,1,
3820,2024-2025,Achieve Academy of Philadelphia - East Campus,Achieve Academy of Philadelphia - East Campus,2016,0,1,1,0,Alternative,Contracted,0,0,0,0,0,0,1,1,1,1,1,1,1,
3850,2024-2025,Northeast High School EOP,Northeast High School EOP,2016,0,0,1,0,Alternative,District,0,0,0,0,0,0,0,0,0,1,1,1,1,
3880,2024-2025,South Philadelphia High School EOP,South Philadelphia High School EOP,2008,0,0,1,0,Alternative,District,0,0,0,0,0,0,0,0,0,1,1,1,1,
4020,2024-2025,Overbrook High School,Overbrook High School,1926,0,0,1,0,Catchment,District,0,0,0,0,0,0,0,0,0,1,1,1,1,
4030,2024-2025,Carver High School of Engineering and Science,Carver High School of Engineering and Science,1949,0,1,1,0,Criteria-Based,District,0,0,0,0,0,0,0,1,1,1,1,1,1,
4060,2024-2025,Murrell Dobbins Career and Technical Education High School,Murrell Dobbins Career and Technical Education High School,1938,0,0,1,0,Citywide,District,0,0,0,0,0,0,0,0,0,1,1,1,1,
4140,2024-2025,Strawberry Mansion High School,Strawberry Mansion High School,1964,0,0,1,0,Catchment,District,0,0,0,0,0,0,0,0,0,1,1,1,1,
4220,2024-2025,James G. Blaine School,James G. Blaine School,1966,1,1,0,0,Catchment,District,1,1,1,1,1,1,1,1,1,0,0,0,0,
4240,2024-2025,Lewis C. Cassidy Academics Plus School,Lewis C. Cassidy Academics Plus School,1924,1,1,0,0,Catchment,District,1,1,1,1,1,1,1,1,1,0,0,0,0,
4270,2024-2025,William Dick School,William Dick School,1954,1,1,0,0,Catchment,District,1,1,1,1,1,1,1,1,1,0,0,0,0,
4280,2024-2025,Samuel Gompers School,Samuel Gompers School,1968,1,1,0,0,Catchment,District,1,1,1,1,1,1,1,1,1,0,0,0,0,
4300,2024-2025,Edward Heston School,Edward Heston School,1970,1,1,0,0,Catchment,District,1,1,1,1,1,1,1,1,1,0,0,0,0,
4320,2024-2025,Robert E. Lamberton School,Robert E. Lamberton School,1949,1,1,0,0,Catchment,District,1,1,1,1,1,1,1,1,1,0,0,0,0,
4350,2024-2025,E. Washington Rhodes School,E. Washington Rhodes School,2013,1,1,0,0,Catchment,District,1,1,1,1,1,1,1,1,1,0,0,0,0,
4360,2024-2025,Kenderton Elementary School,Kenderton Elementary School,2016,1,1,0,0,Catchment,District,1,1,1,1,1,1,1,1,1,0,0,0,0,
4370,2024-2025,Overbrook Elementary School,Overbrook Elementary School,1990,1,1,0,0,Catchment,District,1,1,1,1,1,1,1,1,1,0,0,0,0,
4380,2024-2025,Thomas M. Peirce School,Thomas M. Peirce School,1908,1,0,0,0,Catchment,District,1,1,1,1,1,1,0,0,0,0,0,0,0,
4440,2024-2025,Dr. Ethel Allen School,Dr. Ethel Allen School,1971,1,1,0,0,Catchment,District,1,1,1,1,1,1,1,1,1,0,0,0,0,
4460,2024-2025,Tanner G. Duckrey School,Tanner G. Duckrey School,1968,1,1,0,0,Catchment,District,1,1,1,1,1,1,1,1,1,0,0,0,0,
4470,2024-2025,Richard R. Wright School,Richard R. Wright School,1970,1,0,0,0,Catchment,District,1,1,1,1,1,1,0,0,0,0,0,0,0,
4480,2024-2025,Overbrook Educational Center,Overbrook Educational Center,1986,1,1,0,0,Citywide,District,1,1,1,1,1,1,1,1,1,0,0,0,0,
4520,2024-2025,Guion S. Bluford School,Guion S. Bluford School,2023,1,1,0,0,Catchment,District,1,1,1,1,1,1,1,1,1,0,0,0,0,
4530,2024-2025,Edward Gideon School,Edward Gideon School,1952,1,1,0,0,Catchment,District,1,1,1,1,1,1,1,1,1,0,0,0,0,
4560,2024-2025,William D. Kelley School,William D. Kelley School,1965,1,1,0,0,Catchment,District,1,1,1,1,1,1,1,1,1,0,0,0,0,
4570,2024-2025,General George G. Meade School,General George G. Meade School,1937,1,1,0,0,Catchment,District,1,1,1,1,1,1,1,1,1,0,0,0,0,
5020,2024-2025,Thomas A. Edison High School,Thomas A. Edison High School,1985,0,0,1,0,Catchment,District,0,0,0,0,0,0,0,0,0,1,1,1,1,
5033,2024-2025,Student Transition Center,Student Transition Center,2023,0,0,0,1,Alternative,District,0,1,1,1,1,1,1,1,1,1,1,1,1,
